{
  "$schema": "./course.schema.json",
  "version": 1,
  "id": "conditionals",
  "title": {
    "en": "Conditionals",
    "bn": "Conditional (If-বাক্য)"
  },
  "tagline": {
    "en": "If this happens, then…",
    "bn": "যদি এটা হয়, তাহলে…"
  },
  "subtitle": {
    "en": "Every card has a short rule and 3 questions. Learn the zero, first, second and third conditionals, and never put will after if.",
    "bn": "প্রতিটি কার্ডে ছোট্ট নিয়ম আর ৩টি প্রশ্ন। zero, first, second আর third conditional শেখো, আর if-এর পরে কখনো will নয়।"
  },
  "sections": [
    {
      "id": "real",
      "title": {
        "en": "Real conditions",
        "bn": "বাস্তব শর্ত"
      },
      "hint": {
        "en": "Facts and likely futures",
        "bn": "সত্য ঘটনা আর সম্ভাব্য ভবিষ্যৎ"
      }
    },
    {
      "id": "imagined",
      "title": {
        "en": "Imagined now",
        "bn": "কাল্পনিক বর্তমান"
      },
      "hint": {
        "en": "If I were you…",
        "bn": "আমি যদি তুমি হতাম…"
      }
    },
    {
      "id": "past",
      "title": {
        "en": "Imagined past",
        "bn": "কাল্পনিক অতীত"
      },
      "hint": {
        "en": "What if it had happened?",
        "bn": "যা ঘটেনি, তা কল্পনা করো"
      }
    }
  ],
  "cards": [
    {
      "id": "zero-conditional",
      "order": 1,
      "section": "real",
      "title": {
        "en": "Zero Conditional: Facts",
        "bn": "Zero Conditional: সত্য ঘটনা"
      },
      "badge": "If + present, present",
      "recap": {
        "rule": {
          "en": "Use if + present, present for things that are always true, like facts of science.",
          "bn": "যা সবসময় সত্য, যেমন বিজ্ঞানের তথ্য, তার জন্য if + present, present।"
        },
        "example": "If you heat ice, it melts."
      },
      "questions": [
        {
          "id": "zero-conditional-1",
          "prompt": "If you mix red and white, you ___ pink.",
          "options": [
            {
              "id": "a",
              "text": "got",
              "why": "This is always true, so use the present, not the past."
            },
            {
              "id": "b",
              "text": "get"
            },
            {
              "id": "c",
              "text": "will got",
              "why": "After will, use the base verb. And facts use the present anyway."
            },
            {
              "id": "d",
              "text": "getting",
              "why": "The verb needs a tense: get."
            }
          ],
          "answer": "b",
          "explanation": "Always true: if + present, present."
        },
        {
          "id": "zero-conditional-2",
          "prompt": "Water ___ if you heat it to 100°C.",
          "options": [
            {
              "id": "a",
              "text": "boil",
              "why": "Water is singular, so add -s: boils."
            },
            {
              "id": "b",
              "text": "boiled",
              "why": "This is always true, so use the present."
            },
            {
              "id": "c",
              "text": "boils"
            },
            {
              "id": "d",
              "text": "would boil",
              "why": "would is for imagined things, but this is a fact."
            }
          ],
          "answer": "c",
          "explanation": "Fact: present simple, boils."
        },
        {
          "id": "zero-conditional-3",
          "prompt": "Which sentence is a zero conditional?",
          "options": [
            {
              "id": "a",
              "text": "If you heat butter, it will melt.",
              "why": "That is a first conditional (will)."
            },
            {
              "id": "b",
              "text": "If you heated butter, it would melt.",
              "why": "That is a second conditional (past + would)."
            },
            {
              "id": "c",
              "text": "If you heat butter, it melts."
            },
            {
              "id": "d",
              "text": "If you had heated butter, it would have melted.",
              "why": "That is a third conditional."
            }
          ],
          "answer": "c",
          "explanation": "Zero conditional: the present in both parts."
        }
      ]
    },
    {
      "id": "first-conditional",
      "order": 2,
      "section": "real",
      "title": {
        "en": "First Conditional: Real Future",
        "bn": "First Conditional: বাস্তব ভবিষ্যৎ"
      },
      "badge": "If + present, will + verb",
      "recap": {
        "rule": {
          "en": "Use if + present, will + verb for a real or likely future. Never put will after if.",
          "bn": "বাস্তব বা সম্ভাব্য ভবিষ্যতের জন্য if + present, will + verb। if-এর পরে কখনো will বসবে না।"
        },
        "example": "If it rains, I’ll stay at home."
      },
      "questions": [
        {
          "id": "first-conditional-1",
          "prompt": "If you study, you ___.",
          "options": [
            {
              "id": "a",
              "text": "would pass",
              "why": "would is for imagined things. This future is real."
            },
            {
              "id": "b",
              "text": "passed",
              "why": "This is about the future, so use will pass."
            },
            {
              "id": "c",
              "text": "will passing",
              "why": "After will, use the base verb: pass."
            },
            {
              "id": "d",
              "text": "will pass"
            }
          ],
          "answer": "d",
          "explanation": "Real future result: will + verb."
        },
        {
          "id": "first-conditional-2",
          "prompt": "If she ___ tomorrow, we will go out.",
          "options": [
            {
              "id": "a",
              "text": "will come",
              "why": "Never put will after if. Use the present: comes."
            },
            {
              "id": "b",
              "text": "come",
              "why": "With she, add -s: comes."
            },
            {
              "id": "c",
              "text": "came",
              "why": "came is past. For a real future, use the present after if."
            },
            {
              "id": "d",
              "text": "comes"
            }
          ],
          "answer": "d",
          "explanation": "if + present (comes), will + verb."
        },
        {
          "id": "first-conditional-3",
          "prompt": "Which sentence is correct?",
          "options": [
            {
              "id": "a",
              "text": "If it will rain, I will stay at home.",
              "why": "Never put will after if."
            },
            {
              "id": "b",
              "text": "If it rain, I will stay at home.",
              "why": "With it, add -s: rains."
            },
            {
              "id": "c",
              "text": "If it rains, I will stay at home."
            },
            {
              "id": "d",
              "text": "If it rains, I would stay at home.",
              "why": "A real future uses will, not would."
            }
          ],
          "answer": "c",
          "explanation": "if + present, will + verb."
        }
      ]
    },
    {
      "id": "unless-when",
      "order": 3,
      "section": "real",
      "title": {
        "en": "Unless / When / As soon as",
        "bn": "Unless / When / As soon as"
      },
      "badge": "unless = if not",
      "recap": {
        "rule": {
          "en": "unless means if not. After unless, when and as soon as, use the present to talk about the future.",
          "bn": "unless মানে if not। unless, when, as soon as-এর পরে ভবিষ্যৎ বোঝাতেও present ব্যবহার করো।"
        },
        "example": "Unless you hurry, you’ll miss the bus. · I’ll call when I arrive."
      },
      "questions": [
        {
          "id": "unless-when-1",
          "prompt": "___ you hurry, you’ll be late.",
          "options": [
            {
              "id": "a",
              "text": "If",
              "why": "“If you hurry, you’ll be late” makes no sense. You mean if you don’t hurry."
            },
            {
              "id": "b",
              "text": "When",
              "why": "“When you hurry, you’ll be late” makes no sense."
            },
            {
              "id": "c",
              "text": "As soon as",
              "why": "Hurrying doesn’t make you late. You need “if not”."
            },
            {
              "id": "d",
              "text": "Unless"
            }
          ],
          "answer": "d",
          "explanation": "Unless = if not: if you don’t hurry, you’ll be late."
        },
        {
          "id": "unless-when-2",
          "prompt": "I’ll text you as soon as I ___ home.",
          "options": [
            {
              "id": "a",
              "text": "will reach",
              "why": "No will after as soon as. Use the present."
            },
            {
              "id": "b",
              "text": "reach"
            },
            {
              "id": "c",
              "text": "reached",
              "why": "This is about the future, so use the present after as soon as."
            },
            {
              "id": "d",
              "text": "reaching",
              "why": "The verb needs a tense: reach."
            }
          ],
          "answer": "b",
          "explanation": "as soon as + present, for the future."
        },
        {
          "id": "unless-when-3",
          "prompt": "“If you don’t water the plant, it will die.” Which means the same?",
          "options": [
            {
              "id": "a",
              "text": "Unless you don’t water the plant, it will die.",
              "why": "unless already means if not. Don’t add another not."
            },
            {
              "id": "b",
              "text": "Unless you will water the plant, it will die.",